<?xml version="1.0" encoding="UTF-8"?>
<NaucniRad xmlns="naucni_rad"
 xmlns:xsi="http://www.w3.org/2001/XMLSchema-instance"
 xsi:schemaLocation="naucni_rad file:/E:/XML/proj/xws/Schemas/naucni_rad.xsd">
    <NaslovnaStrana>
        <Naslov>Naslov0</Naslov>
        <Autori>
            <Autor>
                <Ime>Ime0</Ime>
                <Prezime>Prezime0</Prezime>
                <EMail>a@a.a</EMail>
                <BrojTelefona>BrojTelefona0</BrojTelefona>
                <ORCID>0000-dddd-dddd-dddd</ORCID>
                <Ustanova>
                    <Naziv>Naziv0</Naziv>
                    <Adresa>
                        <Ulica>Ulica0</Ulica>
                        <Broj>Broj0</Broj>
                        <Grad>Grad0</Grad>
                        <Drzava>Drzava0</Drzava>
                        <PostanskiBroj>PostanskiBroj0</PostanskiBroj>
                    </Adresa>
                </Ustanova>
            </Autor>
            <Autor>
                <Ime>Ime1</Ime>
                <Prezime>Prezime1</Prezime>
                <EMail>a@a.a</EMail>
                <BrojTelefona>BrojTelefona1</BrojTelefona>
                <ORCID>0000-dddd-dddd-dddd</ORCID>
                <Ustanova>
                    <Naziv>Naziv1</Naziv>
                    <Adresa>
                        <Ulica>Ulica1</Ulica>
                        <Broj>Broj1</Broj>
                        <Grad>Grad1</Grad>
                        <Drzava>Drzava1</Drzava>
                        <PostanskiBroj>PostanskiBroj1</PostanskiBroj>
                    </Adresa>
                </Ustanova>
            </Autor>
        </Autori>
    </NaslovnaStrana>
    <Abstrakt>Abstrakt0</Abstrakt>
    <KljucneReci>
        <KljucnaRec>KljucnaRec0</KljucnaRec>
        <KljucnaRec>KljucnaRec1</KljucnaRec>
        <KljucnaRec>KljucnaRec2</KljucnaRec>
        <KljucnaRec>KljucnaRec3</KljucnaRec>
    </KljucneReci>
    <Poglavlja>
        <Poglavlje>
            <Naslov>Naslov1</Naslov>
            <Pasus>
                <Slika>
                    <Sadrzaj>ZGVmYXVsdA==</Sadrzaj>
                    <Naziv>Naziv2</Naziv>
                    <IdReference>IdReference0</IdReference>
                </Slika>
                <Tabela>
                    <Red>
                        <Celija>Celija0</Celija>
                        <Celija>Celija1</Celija>
                    </Red>
                    <Red>
                        <Celija>Celija2</Celija>
                        <Celija>Celija3</Celija>
                    </Red>
                </Tabela>
                <Lista>
                    <Stavka>Stavka0</Stavka>
                </Lista>
                <Tekst>
                    <Sadrzaj>Sadrzaj0</Sadrzaj>
                    <IdReference>IdReference1</IdReference>
                </Tekst>
                <Slika>
                    <Sadrzaj>ZGVmYXVsdA==</Sadrzaj>
                    <Naziv>Naziv3</Naziv>
                    <IdReference>IdReference2</IdReference>
                </Slika>
                <Tabela>
                    <Red>
                        <Celija>Celija4</Celija>
                        <Celija>Celija5</Celija>
                    </Red>
                    <Red>
                        <Celija>Celija6</Celija>
                        <Celija>Celija7</Celija>
                    </Red>
                </Tabela>
                <Lista>
                    <Stavka>Stavka1</Stavka>
                </Lista>
                <Tekst>
                    <Sadrzaj>Sadrzaj1</Sadrzaj>
                    <IdReference>IdReference3</IdReference>
                </Tekst>
            </Pasus>
            <Pasus>
                <Slika>
                    <Sadrzaj>ZGVmYXVsdA==</Sadrzaj>
                    <Naziv>Naziv4</Naziv>
                    <IdReference>IdReference4</IdReference>
                </Slika>
                <Tabela>
                    <Red>
                        <Celija>Celija8</Celija>
                        <Celija>Celija9</Celija>
                    </Red>
                    <Red>
                        <Celija>Celija10</Celija>
                        <Celija>Celija11</Celija>
                    </Red>
                </Tabela>
                <Lista>
                    <Stavka>Stavka2</Stavka>
                </Lista>
                <Tekst>
                    <Sadrzaj>Sadrzaj2</Sadrzaj>
                    <IdReference>IdReference5</IdReference>
                </Tekst>
                <Slika>
                    <Sadrzaj>ZGVmYXVsdA==</Sadrzaj>
                    <Naziv>Naziv5</Naziv>
                    <IdReference>IdReference6</IdReference>
                </Slika>
                <Tabela>
                    <Red>
                        <Celija>Celija12</Celija>
                        <Celija>Celija13</Celija>
                    </Red>
                    <Red>
                        <Celija>Celija14</Celija>
                        <Celija>Celija15</Celija>
                    </Red>
                </Tabela>
                <Lista>
                    <Stavka>Stavka3</Stavka>
                </Lista>
                <Tekst>
                    <Sadrzaj>Sadrzaj3</Sadrzaj>
                    <IdReference>IdReference7</IdReference>
                </Tekst>
            </Pasus>
        </Poglavlje>
    </Poglavlja>
    <Reference>
        <Referenca>
            <NazivRada>NazivRada0</NazivRada>
            <URLRada>URLRada0</URLRada>
            <Autor>Autor0</Autor>
            <Autor>Autor1</Autor>
        </Referenca>
    </Reference>
</NaucniRad>
